{
  "meta": {
    "name": "Amouzougan Kangni Juvanio",
    "available": true,
    "contact": {
      "email": "jamouzougan@gmail.com",
      "phone": "+228 96 85 89 12",
      "linkedin": "https://www.linkedin.com/in/kangni-juvanio-amouzougan-709918189/",
      "linkedin_handle": "kangni-juvanio-amouzougan-709918189",
      "github": "https://github.com/boboprem1",
      "github_handle": "boboprem1",
      "pypi": "https://pypi.org/project/tenxyte/",
      "pypi_handle": "tenxyte",
      "cv": "G_Curriculum_Vitae.pdf"
    }
  },

  "navbar": {
    "fr": {
      "profil": "Profil",
      "tenxyte": "Tenxyte",
      "skills": "Skills",
      "experience": "Expérience",
      "contact": "Contact",
      "dark": "DARK",
      "light": "LIGHT"
    },
    "en": {
      "profil": "Profile",
      "tenxyte": "Tenxyte",
      "skills": "Skills",
      "experience": "Experience",
      "contact": "Contact",
      "dark": "DARK",
      "light": "LIGHT"
    }
  },

  "footer": {
    "fr": {
      "copyright": "© 2026 Amouzougan Kangni Juvanio",
      "role": "Backend Architect",
      "location": "Lomé, Togo 🇹🇬"
    },
    "en": {
      "copyright": "© 2026 Amouzougan Kangni Juvanio",
      "role": "Backend Architect",
      "location": "Lome, Togo 🇹🇬"
    }
  },

  "hero": {
    "fr": {
      "tag": "Backend Architect · DevSecOps · AI-Ready",
      "title": "Ingénieur Senior Spécialisé Backend & Sécurité",
      "positioning": "Django · NestJS · Laravel · DevSecOps",
      "founder": "Fondateur de",
      "framework": "Framework Open Source",
      "desc": "Habitué à intervenir en autonomie complète — de la conception à la mise en production — aussi bien en solo qu'en",
      "leadership": "leadership technique d'équipe",
      "contactBtn": "Me contacter",
      "cvBtn": "Télécharger CV",
      "expBtn": "Voir l'expérience",
      "scroll": "Scroll"
    },
    "en": {
      "tag": "Backend Architect · DevSecOps · AI-Ready",
      "title": "Senior Backend & Security Engineer",
      "positioning": "Django · NestJS · Laravel · DevSecOps",
      "founder": "Founder of",
      "framework": "Open Source Framework",
      "desc": "Accustomed to operating in complete autonomy — from design to production deployment — whether working solo or providing",
      "leadership": "technical team leadership",
      "contactBtn": "Contact me",
      "cvBtn": "Download CV",
      "expBtn": "View experience",
      "scroll": "Scroll"
    }
  },

  "tenxyte": {
    "fr": {
      "badge": "Projet Phare · Open Source",
      "desc": "Framework Python open-source d'authentification & sécurité production-ready. Conçu pour des backends exposés à des agents IA, avec un module AIRS dédié à la sécurité des interactions entre IA et systèmes critiques.",
      "stats": {
        "tests": "Tests Auto.",
        "coverage": "Couverture",
        "published": "Publié"
      },
      "statsValues": {
        "tests": "2 300+",
        "coverage": "~100%",
        "published": "PyPi"
      },
      "cta": {
        "package": "PyPi Package",
        "docs": "Documentation"
      },
      "label": "Architecture Blueprint",
      "layer0": {
        "label": "Layer 0 — Entrypoint",
        "name": "Client / Agent IA",
        "desc": "Frontend, Mobile App, LLM Agent, Service Externe"
      },
      "layer1": {
        "authLabel": "Middleware",
        "authName": "🔐 Auth Engine",
        "authDesc": "JWT · RBAC · 2FA · WebAuthn",
        "airsLabel": "Middleware — AI Security",
        "airsName": "🤖 Module AIRS",
        "airsDesc": "Prompt injection defense, rate limiting par intent, audit trail IA",
        "secLabel": "Middleware",
        "secName": "🛡️ Security Layer",
        "secDesc": "OWASP · CORS · Rate Limit · CSRF · XSS"
      },
      "layer2": {
        "apiLabel": "Core",
        "apiName": "⚙️ API Gateway",
        "apiDesc": "REST APIs · OpenAPI · Validation · Serialization",
        "bizLabel": "Core",
        "bizName": "🧩 Business Logic",
        "bizDesc": "Clean Architecture · DDD · SOLID · Services"
      },
      "layer3": {
        "persistLabel": "Persistence",
        "pgName": "🗄️ PostgreSQL",
        "pgDesc": "Primary store",
        "mongoName": "🍃 MongoDB",
        "mongoDesc": "Document store",
        "mysqlName": "🐬 MySQL",
        "mysqlDesc": "Relational store"
      }
    },
    "en": {
      "badge": "Flagship Project · Open Source",
      "desc": "Production-ready open-source Python authentication & security framework. Designed for backends exposed to AI agents, featuring a dedicated AIRS module for securing AI-system interactions.",
      "stats": {
        "tests": "Auto Tests",
        "coverage": "Coverage",
        "published": "Published"
      },
      "statsValues": {
        "tests": "2,300+",
        "coverage": "~100%",
        "published": "PyPi"
      },
      "cta": {
        "package": "PyPi Package",
        "docs": "Documentation"
      },
      "label": "Architecture Blueprint",
      "layer0": {
        "label": "Layer 0 — Entrypoint",
        "name": "Client / AI Agent",
        "desc": "Frontend, Mobile App, LLM Agent, External Service"
      },
      "layer1": {
        "authLabel": "Middleware",
        "authName": "🔐 Auth Engine",
        "authDesc": "JWT · RBAC · 2FA · WebAuthn",
        "airsLabel": "Middleware — AI Security",
        "airsName": "🤖 AIRS Module",
        "airsDesc": "Prompt injection defense, intent-based rate limiting, AI audit trail",
        "secLabel": "Middleware",
        "secName": "🛡️ Security Layer",
        "secDesc": "OWASP · CORS · Rate Limit · CSRF · XSS"
      },
      "layer2": {
        "apiLabel": "Core",
        "apiName": "⚙️ API Gateway",
        "apiDesc": "REST APIs · OpenAPI · Validation · Serialization",
        "bizLabel": "Core",
        "bizName": "🧩 Business Logic",
        "bizDesc": "Clean Architecture · DDD · SOLID · Services"
      },
      "layer3": {
        "persistLabel": "Persistence",
        "pgName": "🗄️ PostgreSQL",
        "pgDesc": "Primary store",
        "mongoName": "🍃 MongoDB",
        "mongoDesc": "Document store",
        "mysqlName": "🐬 MySQL",
        "mysqlDesc": "Relational store"
      }
    }
  },

  "skills": {
    "fr": {
      "sectionNum": "02",
      "sectionLabel": "Compétences",
      "title1": "Boîte à",
      "title2": "outils",
      "racks": {
        "arch": {
          "rackId": "RACK-01",
          "icon": "🏗️",
          "leds": ["green", "green", "yellow"],
          "title": "Architecture",
          "tags": ["Microservices", "DDD", "Algorithmes", "Clean Arch.", "SOLID", "TDD", "REST API", "OpenAPI"]
        },
        "sec": {
          "rackId": "RACK-02",
          "icon": "🔒",
          "leds": ["red", "green", "green"],
          "title": "Sécurité",
          "tags": ["OWASP", "ISO 27001", "SOC2", "GDPR", "AML/KYC", "JWT", "RBAC", "2FA"]
        },
        "back": {
          "rackId": "RACK-03",
          "icon": "⚙️",
          "leds": ["green", "green", "green"],
          "title": "Backend",
          "tags": ["Python", "Django", "FastAPI", "Node.js", "NestJS", "Express", "PHP", "Laravel", "TypeScript"]
        },
        "cloud": {
          "rackId": "RACK-04",
          "icon": "☁️",
          "leds": ["green", "yellow", "green"],
          "title": "Cloud & DevOps",
          "tags": ["AWS EC2/S3/LightSail", "AWS IAM/SES", "Docker", "Linux", "Nginx", "GitHub Actions", "GitLab", "Agile/Scrum", "Jenkins", "Kubernetes", "Terraform"]
        },
        "db": {
          "rackId": "RACK-05",
          "icon": "🗄️",
          "leds": ["green", "green", "yellow"],
          "title": "Bases de données",
          "tags": ["PostgreSQL", "MySQL", "MongoDB", "Modélisation", "Optimisation"]
        },
        "front": {
          "rackId": "RACK-06",
          "icon": "🖥️",
          "leds": ["green", "green", "green"],
          "title": "Frontend",
          "tags": ["React.js", "Next.js", "Vue.js", "Redux", "Tailwind", "TypeORM"]
        },
        "lang": {
          "rackId": "RACK-07",
          "icon": "🌍",
          "leds": ["green", "green", "green"],
          "title": "Langues",
          "items": [
            { "name": "Éwé", "level": "Natif", "width": "100%" },
            { "name": "Français", "level": "Officiel", "width": "100%" },
            { "name": "Anglais", "level": "Professionnel", "width": "85%" },
            { "name": "Allemand", "level": "Débutant", "width": "20%" }
          ]
        },
        "hobbies": {
          "title": "Loisirs & Centres d'intérêt",
          "tags": ["Musique", "Écriture", "Lecture", "Danse", "Mangas", "Arts Martiaux", "Gymnastique", "Sports (Football, Basket)"]
        }
      }
    },
    "en": {
      "sectionNum": "02",
      "sectionLabel": "Skills",
      "title1": "Tool",
      "title2": "box",
      "racks": {
        "arch": {
          "rackId": "RACK-01",
          "icon": "🏗️",
          "leds": ["green", "green", "yellow"],
          "title": "Architecture",
          "tags": ["Microservices", "DDD", "Algorithms", "Clean Arch.", "SOLID", "TDD", "REST API", "OpenAPI"]
        },
        "sec": {
          "rackId": "RACK-02",
          "icon": "🔒",
          "leds": ["red", "green", "green"],
          "title": "Security",
          "tags": ["OWASP", "ISO 27001", "SOC2", "GDPR", "AML/KYC", "JWT", "RBAC", "2FA"]
        },
        "back": {
          "rackId": "RACK-03",
          "icon": "⚙️",
          "leds": ["green", "green", "green"],
          "title": "Backend",
          "tags": ["Python", "Django", "FastAPI", "Node.js", "NestJS", "Express", "PHP", "Laravel", "TypeScript"]
        },
        "cloud": {
          "rackId": "RACK-04",
          "icon": "☁️",
          "leds": ["green", "yellow", "green"],
          "title": "Cloud & DevOps",
          "tags": ["AWS EC2/S3/LightSail", "AWS IAM/SES", "Docker", "Linux", "Nginx", "GitHub Actions", "GitLab", "Agile/Scrum", "Jenkins", "Kubernetes", "Terraform"]
        },